### ISSUE TITLE
Entire network bandwidth gets consumed after chrome 102.0.5005.61 image upgrade

### ISSUE THREAD

**Issue by nmilovanovic1985** [aerokube/images#544]
Setup that we are using:
On one server we have GGR
On separate two servers, on each server we have 4 Selenoid docker nodes that can run up to 6 docker containers in total 48 chrome test containers
Selenium tests are executed via Jenkins
We create chrome images locally using aerokube/images

After we created an image for chrome 102.0.5005.61 we found an issue with internet consumption, our download goes from 180 mb/s to 0 mb/s in just a couple of minutes when all 48 containers are running.
We have the same issue with all the new chrome versions that came after 102.0.5005.61.

At the moment we are still running our tests on chrome 101.0.4951.64 with this version we have no issues and network impact is minimal with all 48 containers running.

We have pulled all the latest versions of selenoid, ggr, selenoid-ui, and upgraded to image 7.3.0, we have pulled both selenoid/chrome:101.0 and selenoid/chrome:102.0 chrome image from docker hub without building them locally and reproduced the same behavior where chrome 101 is working with no issue and 102 kills the network… 

This problem blocks chrome upgrade for us, if you have any idea what the problem can be it would be nice,  and if any more info needs to be provided from our side I will be more than willing to share

Thanks

**Comment by vania-pooh** [comment]
@nmilovanovic1985 any traffic dump could help to diagnose this.

**Comment by nmilovanovic1985** [comment]
HI

I have compared the traffic between chrome 101 and 102 versions using tcpdump and if my observation is correct there is a difference in outgoing calls that are made by chrome, there is a larger number of call targeting 104.22.17.242:

11:14:21.129796 IP 10.x.x.x.51705 > 104.22.17.242.https: UDP, length 45
11:14:21.129916 IP 10.x.x.x.51705 > 104.22.17.242.https: UDP, length 45
11:14:21.129969 IP 10.x.x.x.51705 > 104.22.17.242.https: UDP, length 45
11:14:21.130094 IP 10.x.x.x.51705 > 104.22.17.242.https: UDP, length 45
11:14:21.130148 IP 10.x.x.x.51705 > 104.22.17.242.https: UDP, length 45
11:14:21.130197 IP 10.x.x.x.51705 > 104.22.17.242.https: UDP, length 45

11:14:21.132078 IP 104.22.17.242.https > 10.x.x.x.51705: UDP, length 1200
11:14:21.132127 IP 104.22.17.242.https > 10.x.x.x.51705: UDP, length 1200
11:14:21.132127 IP 104.22.17.242.https > 10.x.x.x.51705: UDP, length 1200
11:14:21.132177 IP 104.22.17.242.https > 10.x.x.x.51705: UDP, length 1200
11:14:21.132177 IP 104.22.17.242.https > 10.x.x.x.51705: UDP, length 1200
11:14:21.132177 IP 104.22.17.242.https > 10.x.x.x.51705: UDP, length 1200
11:14:21.132177 IP 104.22.17.242.https > 10.x.x.x.51705: UDP, length 1200
[
I also found something about the new security chrome implementation that can be affected if chrome is used from a secure-private network. I am not sure if this is the source of the problem and is there a way to suppress these outgoing calls.](https://developer.chrome.com/blog/private-network-access-preflight/#:~:text=Preflight%20requests%20are%20a%20mechanism,that%20might%20have%20side%20effects)

What is very strange is that I couldn't any similar issue reported and I and my team have been struggling with this for some time.

**Comment by nmilovanovic1985** [comment]
I also tried with "InsecurePrivateNetworkRequestsAllowed" policy enabled, but it didn't have any effect
![Screenshot 2022-07-15 at 12 18 17](https://user-images.githubusercontent.com/71589120/179205190-684d3da5-d6e8-4401-ab99-387ceee1059a.png)
t

**Comment by nmilovanovic1985** [comment]
https://bugs.chromium.org/p/chromium/issues/detail?id=1329852&q=internet&can=2

Also found this issue and added a net-export attachment in the comment.

**Comment by Dor-bl** [comment]
we have the same issue. on chrome images >101.0 network reach over 200 Mbps.
any input on that?

**Comment by nmilovanovic1985** [comment]
we have no issue with chrome 101, only 102 and newer versions, and still waiting on our network team to determine what is consuming our entire network when we run our tests... very frustrating... :(

**Comment by nmilovanovic1985** [comment]
The latest finding that we have is that when all container or active download on our docker nodes is very high
![MicrosoftTeams-image](https://user-images.githubusercontent.com/71589120/187874196-310fba50-571c-4787-8a45-ac993f73cf89.png)

A couple of things that I want to add regarding this finding:
- we don't use aerokube cm project, we pull the images manually 
- we don't have a docker registry mirroring in place, can this be an issue??

Is there a possibility that on container start something triggers a download of some missing layers in the [background](https://docs.docker.com/registry/recipes/mirror/#use-case)?

We will try to find the source of the download usage later this day so I will give an update if we find something new

**Comment by vania-pooh** [comment]
@nmilovanovic1985 we just install official browser packages to our images. A tcpdump capture of the traffic could help to diagnose.

**Comment by nmilovanovic1985** [comment]
@vania-pooh 
Here is a [link](https://we.tl/t-0HYgm79Vk9) to download tdpdump the file it was too big to upload here.

Thanks in advanced

**Comment by Dor-bl** [comment]
So latest response on this in chromium issues from Google is as followed  :
"are you folks starting a bunch of tests with a fresh --user-data-dir every time or something? That thing may not work so well if you start fresh every time, though I am not sure what to suggest"

**Comment by vania-pooh** [comment]
@Dor-bl `chromedriver` itself probably does this itself.

**Comment by Dor-bl** [comment]
@vania-pooh And this was the second comment from Google maintainer : `Hmm, so I can't find an off switch, but something like --component-updater=initial-delay=86400 might help, or maybe --component-updater=url-source=https://some-syntactically-valid-but-not-resolving-url/`

**Comment by nmilovanovic1985** [comment]
<img width="931" alt="firstTest" src="https://user-images.githubusercontent.com/71589120/188409456-2553ab8a-a414-4cf8-b93c-01ddb3167eb6.png">
<img width="1059" alt="secondTest" src="https://user-images.githubusercontent.com/71589120/188409472-bfb79a96-a438-4026-bd24-d0b428c4873e.png">

Same result when I used this switch... :(

**Comment by nmilovanovic1985** [comment]
@vania-pooh @Dor-bl 
Finally, I've found a solution that works for us by disabling [chrome component updates](https://support.google.com/chrome/a/answer/9052345?hl=en#zippy=%2Cstep-turn-off-chrome-browser-component-updates-optional%2Cstep-turn-off-chrome-browser-updates)

In /static/chrome/Dockerfile i added:

RUN \
mkdir -p /etc/opt/chrome/policies/managed/ && \
chown selenium:nogroup /etc/opt/chrome/policies/managed/ && \
cd /etc/opt/chrome/policies/managed/ && \
touch component_update.json && \
echo {"\n""\"ComponentUpdatesEnabled\"": false"\n"} >> component_update.json

With this component-update policy was disabled and there is no download issue:
![Screenshot 2022-09-05 at 12 23 04](https://user-images.githubusercontent.com/71589120/188427711-67a9c14c-02e9-4eab-b792-6c2d18c73299.png)

**Comment by vania-pooh** [comment]
@nmilovanovic1985 need to add this to our images.

**Comment by vania-pooh** [comment]
Will rebuild Chrome 105.0 image soon.
